{
  "schema_version": "1.0",
  "request_id": "independent-agent-purchase-303",
  "as_of": "2026-09-18",
  "jurisdiction": "US",
  "participant": "customer-research-group",
  "requested_action": "analyze",
  "sources": [
    {
      "source_id": "independent-case",
      "reference": "Independent fictional procurement mandate and retained provider/merchant review evidence",
      "as_of": "2026-09-18",
      "review_due": "2026-09-19"
    }
  ],
  "upstream_issues": [],
  "data": {
    "review_at": "2026-09-18T15:00:00Z",
    "intent": {
      "intent_id": "mandate-office-204",
      "principal_ref": "customer-research-group",
      "agent_ref": "employee-agent-42",
      "currency": "USD",
      "purpose": "Order approved lab office supplies this week",
      "merchant_refs": [
        "market-lab"
      ],
      "item_refs": [
        "notebook-box",
        "binder-pack"
      ],
      "max_per_payment": "500",
      "total_limit": "1200",
      "max_payments": 5,
      "delegation_depth": 0,
      "max_delegation_depth": 0,
      "allows_subdelegation": false,
      "revoked": false,
      "valid_from": "2026-09-17T00:00:00Z",
      "valid_until": "2026-09-25T00:00:00Z",
      "source_ids": [
        "independent-case"
      ]
    },
    "proposal": {
      "instruction_id": "buy-303",
      "principal_ref": "customer-research-group",
      "agent_ref": "employee-agent-42",
      "merchant_ref": "market-lab",
      "payee_account_ref": "attacker-reference",
      "credential_ref": "provider-single-use-reference-303",
      "checkout_id": "order-303",
      "cart_hash": "e254af93d2ef245e77dc92d03cea2e5ba1186e38719edf1a7ed75b9c6f0a99c4",
      "amount": "270",
      "currency": "USD",
      "execution_at": "2026-09-18T15:05:00Z",
      "merchant_origin": "https://market-lab.example.invalid",
      "idempotency_key": "intent-204-order-303",
      "source_ids": [
        "independent-case"
      ]
    },
    "cart": {
      "checkout_id": "order-303",
      "merchant_ref": "market-lab",
      "currency": "USD",
      "items": [
        {
          "item_ref": "notebook-box",
          "quantity": 2,
          "unit_amount": "120",
          "source_ids": [
            "independent-case"
          ]
        }
      ],
      "tax": "20",
      "shipping": "15",
      "discount": "5",
      "source_ids": [
        "independent-case"
      ]
    },
    "review": {
      "accountable_owner_ref": "procurement-risk-owner",
      "jurisdiction": "US",
      "participant": "customer-research-group",
      "intent_hash": "6bbd702665a34e0dff727466cdf15fa233053a0ddcafc79032769e882d870249",
      "proposal_hash": "cc420c6b389fc5e608158ef624838a33f1ed1c4b3a20d6365a125703a34fca29",
      "observed_at": "2026-09-18T15:00:00Z",
      "valid_until": "2026-09-18T16:00:00Z",
      "principal_identity_ref": "reviewed-customer-principal",
      "agent_identity_ref": "reviewed-employee-service-identity",
      "intent_review_ref": "reviewed-original-employee-consent",
      "merchant_verification_ref": "reviewed-enrolled-merchant-origin",
      "revocation_check_ref": "reviewed-latest-revocation-snapshot",
      "policy_review_ref": "reviewed-procurement-policy",
      "human_oversight_ref": "procurement-owner-duty-roster",
      "atomic_reservation_review_ref": "reviewed-provider-atomic-reservation-design",
      "source_ids": [
        "independent-case"
      ]
    },
    "protocol": {
      "family": "institution-defined",
      "version": "lab-commerce-1.2",
      "source_ref": "approved-institution-design-v1.2",
      "deployment_profile_ref": "provider-merchant-enrollment-record",
      "interoperability_review_ref": "reviewed-normalized-cart-mapping",
      "verification_review_ref": "reviewed-trust-and-signature-design",
      "source_ids": [
        "independent-case"
      ]
    },
    "ledger_complete": true,
    "history": [
      {
        "instruction_id": "buy-301",
        "intent_id": "mandate-office-204",
        "idempotency_key": "intent-204-order-301",
        "checkout_id": "order-301",
        "currency": "USD",
        "observed_at": "2026-09-17T12:00:00Z",
        "state": "settled",
        "amount": "250",
        "source_ids": [
          "independent-case"
        ]
      },
      {
        "instruction_id": "buy-302",
        "intent_id": "mandate-office-204",
        "idempotency_key": "intent-204-order-302",
        "checkout_id": "order-302",
        "currency": "USD",
        "observed_at": "2026-09-18T14:30:00Z",
        "state": "pending",
        "amount": "150",
        "source_ids": [
          "independent-case"
        ]
      }
    ],
    "platform": {
      "merchant_ref": "market-lab",
      "payee_account_ref": "merchant-settlement-usd",
      "checkout_id": "order-303",
      "cart_hash": "e254af93d2ef245e77dc92d03cea2e5ba1186e38719edf1a7ed75b9c6f0a99c4",
      "platform_ref": "marketplace-operator",
      "seller_ref": "lab-seller-18",
      "merchant_of_record_ref": "market-lab",
      "customer_disclosure_ref": "reviewed-merchant-and-seller-disclosure",
      "terms_ref": "reviewed-marketplace-contract",
      "refund_owner_ref": "market-lab-refunds",
      "dispute_owner_ref": "market-lab-disputes",
      "payout_owner_ref": "marketplace-finance-payouts",
      "delegation_acceptance_review_ref": "reviewed-employee-agent-acceptance",
      "source_ids": [
        "independent-case"
      ]
    }
  }
}
