{
  "schema_version": "1.0",
  "request_id": "forward-regional-CA",
  "as_of": "2026-09-18",
  "jurisdiction": "CA",
  "participant": "forward-reviewer",
  "requested_action": "analyze",
  "sources": [
    {
      "source_id": "forward-evidence",
      "reference": "synthetic://independently-authored-payment-contract-and-ledger",
      "as_of": "2026-09-18",
      "review_due": "2026-10-01"
    }
  ],
  "upstream_issues": [],
  "data": {
    "proposals": [
      {
        "proposal_id": "native-credit-push",
        "profile_id": "CA-INTERAC-ETRANSFER",
        "use_case": "domestic-business-credit",
        "accountable_reviewer": "local-specialist",
        "intent_ref": "supplier-invoice-intent",
        "payer_entity": "paying-company",
        "payer_account_ref": "payer-account-opaque",
        "payee_entity": "local-supplier",
        "payee_account_ref": "payee-account-opaque",
        "amount": "275.50",
        "currency": "CAD",
        "participant_review": {
          "access_ref": "forward-reviewed-access_ref",
          "payer_reach_ref": "forward-reviewed-payer_reach_ref",
          "payee_reach_ref": "forward-reviewed-payee_reach_ref",
          "funding_arrangement_ref": "forward-reviewed-funding_arrangement_ref",
          "limits_review_ref": "forward-reviewed-limits_review_ref",
          "fees_review_ref": "forward-reviewed-fees_review_ref",
          "operational_support_ref": "forward-reviewed-operational_support_ref"
        },
        "rule_review": {
          "reviewer": "local-specialist",
          "reference": "current-local-product-review",
          "rule_version": "forward-reviewed-2026",
          "activity_scope_ref": "domestic-business-credit",
          "profile_id": "CA-INTERAC-ETRANSFER",
          "jurisdiction": "CA",
          "use_case": "domestic-business-credit",
          "reviewed_on": "2026-09-17",
          "review_due": "2026-10-01"
        },
        "beneficiary_review": {
          "verification_ref": "payee-identity-review",
          "alias_resolution_ref": "opaque-alias-resolution-review",
          "match_status": "matched",
          "reviewed_on": "2026-09-17",
          "review_due": "2026-10-01",
          "binding": {
            "payer_entity": "paying-company",
            "payer_account_ref": "payer-account-opaque",
            "payee_entity": "local-supplier",
            "payee_account_ref": "payee-account-opaque",
            "amount": "275.50",
            "currency": "CAD"
          }
        },
        "source_ids": [
          "forward-evidence"
        ],
        "delivery_mode": "autodeposit",
        "displayed_legal_name_review_ref": "displayed-name-reviewed"
      }
    ]
  }
}
