{
  "schema_version": "1.0",
  "request_id": "independent-phase4-US",
  "as_of": "2026-09-18",
  "jurisdiction": "US",
  "participant": "independent-payment-review",
  "requested_action": "analyze",
  "sources": [
    {
      "source_id": "independent",
      "reference": "synthetic://independent-phase4-program-case-2026-09-18",
      "as_of": "2026-09-18",
      "review_due": "2026-10-18"
    }
  ],
  "upstream_issues": [],
  "data": {
    "program_type": "virtual",
    "history_complete": true,
    "buyer_entity_id": "buyer",
    "issuer_ref": "licensed-issuer-case",
    "program_contract_ref": "program-contract-case",
    "provider_control_review_ref": "provider-controls-case",
    "credentials": [
      {
        "credential_id": "opaque-virtual-1",
        "owner_entity_id": "buyer",
        "supplier_ref": "supplier",
        "currency": "USD",
        "valid_from": "2026-09-18T00:00:00Z",
        "valid_until": "2026-09-20T00:00:00Z",
        "usage_mode": "limited",
        "max_uses": 3,
        "transaction_limit": "800",
        "total_limit": "1500",
        "allowed_mccs": [
          "5045"
        ],
        "provider_enforcement_ref": "issuer-enforced-control-review",
        "source_ids": [
          "independent"
        ]
      }
    ],
    "invoices": [
      {
        "invoice_id": "invoice-1",
        "invoice_identity_ref": "supplier-invoice-economic-1",
        "buyer_entity_id": "buyer",
        "supplier_ref": "supplier",
        "currency": "USD",
        "remittance_ref": "invoice-remittance",
        "open_amount": "1000",
        "source_ids": [
          "independent"
        ]
      }
    ],
    "attempts": [
      {
        "payment_id": "prior-paid",
        "economic_id": "economic-prior-paid",
        "credential_id": "opaque-virtual-1",
        "invoice_id": "invoice-1",
        "supplier_ref": "supplier",
        "currency": "USD",
        "mcc": "5045",
        "occurred_at": "2026-09-18T10:00:00Z",
        "state": "settled",
        "remittance_ref": "invoice-remittance",
        "amount": "200",
        "purchase_order_ref": "po-approved-1",
        "source_ids": [
          "independent"
        ]
      },
      {
        "payment_id": "held",
        "economic_id": "economic-held",
        "credential_id": "opaque-virtual-1",
        "invoice_id": "invoice-1",
        "supplier_ref": "supplier",
        "currency": "USD",
        "mcc": "5045",
        "occurred_at": "2026-09-18T11:00:00Z",
        "state": "authorization-held",
        "remittance_ref": "invoice-remittance",
        "amount": "300",
        "purchase_order_ref": "po-approved-1",
        "source_ids": [
          "independent"
        ]
      },
      {
        "payment_id": "proposed",
        "economic_id": "economic-proposed",
        "credential_id": "opaque-virtual-1",
        "invoice_id": "invoice-1",
        "supplier_ref": "supplier",
        "currency": "USD",
        "mcc": "5045",
        "occurred_at": "2026-09-18T15:00:00Z",
        "state": "proposed",
        "remittance_ref": "invoice-remittance",
        "amount": "500",
        "purchase_order_ref": "po-approved-1",
        "source_ids": [
          "independent"
        ]
      }
    ]
  }
}
