{
  "schema_version": "1.0",
  "request_id": "u4-refund-history-absent-declared-complete",
  "as_of": "2026-09-18",
  "jurisdiction": "UK",
  "participant": "merchant",
  "requested_action": "draft",
  "sources": [
    {
      "source_id": "requirements",
      "reference": "synthetic:u4-refund-history-absent-declared-complete:requirements",
      "as_of": "2026-09-18",
      "review_due": "2026-10-01"
    },
    {
      "source_id": "access",
      "reference": "synthetic:u4-refund-history-absent-declared-complete:access",
      "as_of": "2026-09-18",
      "review_due": "2026-10-01"
    },
    {
      "source_id": "timing",
      "reference": "synthetic:u4-refund-history-absent-declared-complete:timing",
      "as_of": "2026-09-18",
      "review_due": "2026-10-01"
    },
    {
      "source_id": "funding",
      "reference": "synthetic:u4-refund-history-absent-declared-complete:funding",
      "as_of": "2026-09-18",
      "review_due": "2026-10-01"
    },
    {
      "source_id": "costs",
      "reference": "synthetic:u4-refund-history-absent-declared-complete:costs",
      "as_of": "2026-09-18",
      "review_due": "2026-10-01"
    },
    {
      "source_id": "instruction",
      "reference": "synthetic:u4-refund-history-absent-declared-complete:instruction",
      "as_of": "2026-09-18",
      "review_due": "2026-10-01"
    },
    {
      "source_id": "intent",
      "reference": "synthetic:u4-refund-history-absent-declared-complete:intent",
      "as_of": "2026-09-18",
      "review_due": "2026-10-01"
    },
    {
      "source_id": "screen",
      "reference": "synthetic:u4-refund-history-absent-declared-complete:screen",
      "as_of": "2026-09-18",
      "review_due": "2026-10-01"
    },
    {
      "source_id": "account",
      "reference": "synthetic:u4-refund-history-absent-declared-complete:account",
      "as_of": "2026-09-18",
      "review_due": "2026-10-01"
    },
    {
      "source_id": "policy",
      "reference": "synthetic:u4-refund-history-absent-declared-complete:policy",
      "as_of": "2026-09-18",
      "review_due": "2026-10-01"
    },
    {
      "source_id": "batch",
      "reference": "synthetic:u4-refund-history-absent-declared-complete:batch",
      "as_of": "2026-09-18",
      "review_due": "2026-10-01"
    },
    {
      "source_id": "auth",
      "reference": "synthetic:u4-refund-history-absent-declared-complete:auth",
      "as_of": "2026-09-18",
      "review_due": "2026-10-01"
    },
    {
      "source_id": "mandate",
      "reference": "synthetic:u4-refund-history-absent-declared-complete:mandate",
      "as_of": "2026-09-18",
      "review_due": "2026-10-01"
    },
    {
      "source_id": "delegation",
      "reference": "synthetic:u4-refund-history-absent-declared-complete:delegation",
      "as_of": "2026-09-18",
      "review_due": "2026-10-01"
    },
    {
      "source_id": "outcome",
      "reference": "synthetic:u4-refund-history-absent-declared-complete:outcome",
      "as_of": "2026-09-18",
      "review_due": "2026-10-01"
    },
    {
      "source_id": "history",
      "reference": "synthetic:u4-refund-history-absent-declared-complete:history",
      "as_of": "2026-09-18",
      "review_due": "2026-10-01"
    },
    {
      "source_id": "service",
      "reference": "synthetic:u4-refund-history-absent-declared-complete:service",
      "as_of": "2026-09-18",
      "review_due": "2026-10-01"
    },
    {
      "source_id": "card-profile",
      "reference": "synthetic:u4-refund-history-absent-declared-complete:card-profile",
      "as_of": "2026-09-18",
      "review_due": "2026-10-01"
    }
  ],
  "upstream_issues": [],
  "data": {
    "original_payment": {
      "payment_id": "P-UK-240",
      "state": "posted",
      "amount": "240.00",
      "currency": "GBP",
      "rail_profile_id": "SYNTH-UK-DEBIT",
      "originator_account_ref": "acct:buyer",
      "beneficiary_account_ref": "acct:merchant",
      "source_ids": [
        "outcome"
      ],
      "rail_family": "card",
      "network": "SyntheticNetwork",
      "product": "debit"
    },
    "service_request": {
      "service_id": "S-NEW",
      "payment_id": "P-UK-240",
      "action": "refund",
      "amount": "100.00",
      "currency": "GBP",
      "reason": "Merchant/customer requested partial return of purchase/disbursement",
      "destination_account_ref": "acct:buyer",
      "original_binding": {
        "payment_id": "P-UK-240",
        "amount": "240.00",
        "currency": "GBP",
        "rail_profile_id": "SYNTH-UK-DEBIT",
        "originator_account_ref": "acct:buyer",
        "beneficiary_account_ref": "acct:merchant",
        "state": "posted",
        "rail_family": "card",
        "network": "SyntheticNetwork",
        "product": "debit"
      },
      "source_ids": [
        "service"
      ]
    },
    "prior_service_ledger_complete": true,
    "policy": {
      "effective_from": "2026-09-01",
      "effective_until": "2026-09-30",
      "revoked": false,
      "source_ids": [
        "policy"
      ],
      "jurisdiction": "UK",
      "participants": [
        "merchant"
      ],
      "profile_ids": [
        "SYNTH-UK-DEBIT"
      ],
      "approval_roles": [
        "servicing-supervisor"
      ],
      "permissions": [
        {
          "action": "refund",
          "currency": "GBP",
          "original_states": [
            "settled",
            "posted"
          ],
          "max_amount": "1250.00",
          "deadline_date": "2026-09-30",
          "source_ids": [
            "policy"
          ]
        }
      ],
      "network": "SyntheticNetwork",
      "product": "debit"
    },
    "card_profile": {
      "effective_from": "2026-09-01",
      "effective_until": "2026-09-30",
      "revoked": false,
      "source_ids": [
        "card-profile"
      ],
      "profile_id": "SYNTH-UK-DEBIT",
      "network": "SyntheticNetwork",
      "product": "debit",
      "jurisdiction": "UK",
      "participants": [
        "merchant"
      ],
      "actions": [
        "refund"
      ],
      "source_version": "synthetic-2026-09",
      "reviewed_on": "2026-09-18",
      "review_due": "2026-09-30"
    }
  }
}
